Query,Passage,Method,Judge_1,Judge_2,Judge_3,Final
mariah-carey-place-of-birth-huntington.txt,"...  Greenlawn, New York:    Famous residents:  The pop singer Mariah Carey grew up in Greenlawn.  She attended, and graduated from Harborfields High School.   Jeff Hawkins, born in 1957 in Huntington, New York, and who graduated from Harborfields High School in 1975, is the founder of Palm Computing where he invented the Palm Pilot, and Handspring where he invented the Treo....",proposed,relevant,partial,non-relevant,non-relevant
mariah-carey-place-of-birth-huntington.txt,"...  Make It Happen :   Intro ""Make It Happen"" is a song by American singer and songwriter Mariah Carey.  Written and produced by Carey and C+C Music Factorys David Cole  and Robert Clivillés, it was released on April nbsp;4, 1992, by Columbia Records as the third single from her second studio album, Emotions  .  The pop  -, R B  -, and dance  -influenced track incorporates traces of gospel  in its bridge  and crescendo....",baseline,non-relevant,non-relevant,non-relevant,non-relevant
mariah-carey-place-of-birth-huntington.txt,"...The songs music video was filmed by Diane Martel in Copake, NY in upstate New York during August nbsp;1993.  It features a cameo appearance by Careys dog Jack, and shows her frolicking through a flowerbed and field, swimming in a large pond, boarding a hot air balloon, and dancing alongside several shirtless male dancers.  According to author Chris Nickson, the videos carefree setting harmonized well with the songs soft instrumentation....",baseline,non-relevant,non-relevant,non-relevant,non-relevant
mariah-carey-place-of-birth-huntington.txt,"...The album produced four chart-topping singles in the US and began what would become a string of commercially successful albums which solidified the singer as Columbia  s highest selling act.  Carey and Boyz II Men spent a record sixteen weeks atop the Billboard Hot 100  in 1995–1996 with ""One Sweet Day"", which remains the longest-running number-one song in US chart history  ....",baseline,non-relevant,non-relevant,non-relevant,non-relevant
mariah-carey-place-of-birth-huntington.txt,"...Written and produced by Carey and C+C Music Factorys David Cole  and Robert Clivillés, it was released on April nbsp;4, 1992, by Columbia Records as the third single from her second studio album, Emotions  .  The pop  -, R B  -, and dance  -influenced track incorporates traces of gospel  in its bridge  and crescendo.  Described by author Chris Nickson as Careys most personal and inspirational song  }} ""), it tells of her personal struggles prior to her rise to fame, and how her faith in God helped sustain her....",baseline,non-relevant,non-relevant,non-relevant,non-relevant
mariah-carey-place-of-birth-huntington.txt,"...  Huntington, New York:    Notable people:   Brown, former Lieutenant Governor of Maryland Edwin G.  Burrows, won 1999 Pulitzer Prize for History for the book Gotham: A History of New York City to 1898  Greg Buttle, former NFL football  player for the New York Jets Peter Calandra, Broadway, movie, and television pianist/composer  Mariah Carey, singer-songwriter, born and raised in urban neighborhoods Harry Chapin, singer-songwriter and humanitarian John Coltrane  , famed jazz saxophonist and composer, who lived in Dix Hills during the last years of his life Gerry Cooney, former heavyweight boxer Bob Costas, sportscaster Anthony Cumia, former co-host of XM Satellite Radio program Opie and Anthony, current host of The Anthony Cumia Show Cornelius H.  DeLamater, industrialist, and owner of Eatons Neck Alice G....",proposed,relevant,relevant,relevant,relevant
mariah-carey-place-of-birth-huntington.txt,"...The Census Bureau has also defined a census-designated place  with the same name that corresponds to the most densely populated area, however local understanding of the hamlet may differ somewhat from the census definition. The aggregate demographic and geographic data for the hamlet is also included in the data for the Town of Huntington.  The population was 18,406 at the 2010 census....",baseline_with_expansion,non-relevant,non-relevant,non-relevant,non-relevant
mariah-carey-place-of-birth-huntington.txt,"...  Mariah Carey:    Early life:  Mariah Carey was born in Huntington, New York, to Patricia  and Alfred Roy Carey.  Her mother is of Irish descent, while her father had African-American and Afro-Venezuelan ancestry.  The surname ""Carey"" was adopted by her Venezuelan grandfather, Francisco Núñez, after immigrating to New York....",proposed,relevant,relevant,relevant,relevant
mariah-carey-place-of-birth-huntington.txt,"...The album produced four chart-topping singles in the US and began what would become a string of commercially successful albums which solidified the singer as Columbia  s highest selling act.  Carey and Boyz II Men spent a record sixteen weeks atop the Billboard Hot 100  in 1995–1996 with ""One Sweet Day"", which remains the longest-running number-one song in US chart history  ....",baseline_with_expansion,non-relevant,non-relevant,non-relevant,non-relevant
mariah-carey-place-of-birth-huntington.txt,"...  Huntington , New York:    Famous residents:  Huntington is the birthplace of American poets Walt Whitman and Jupiter Hammon, aerospace pioneer Leroy Grumman, singer Mariah Carey, and actor Ralph Macchio. Other public figures who have resided in Huntington include: Fiorello La Guardia, Leon Friedman, Otto Kahn, William K. ...",proposed,relevant,relevant,relevant,relevant
mariah-carey-place-of-birth-huntington.txt,"...  Make It Happen :   Intro ""Make It Happen"" is a song by American singer and songwriter Mariah Carey.  Written and produced by Carey and C+C Music Factorys David Cole  and Robert Clivillés, it was released on April nbsp;4, 1992, by Columbia Records as the third single from her second studio album, Emotions  .  The pop  -, R B  -, and dance  -influenced track incorporates traces of gospel  in its bridge  and crescendo....",baseline_with_expansion,non-relevant,non-relevant,non-relevant,non-relevant
mariah-carey-place-of-birth-huntington.txt,"...S.  TV series) }} , as well as Careys Rainbow   and Charmbracelet World Tours  . Background According to Carey, writing ""Cant Take That Away "" helped her get through rough emotional moments with her labels management, and even times when she felt overwhelmed by others.  During the early stages of the album, Carey said she felt pressured to complete the Rainbow album as quickly as possible, due to the fact that it was the last album under her contract with Columbia  ....",baseline_with_expansion,non-relevant,non-relevant,non-relevant,non-relevant
mariah-carey-place-of-birth-huntington.txt,"...S.  TV series) }} , as well as Careys Rainbow   and Charmbracelet World Tours  . Background According to Carey, writing ""Cant Take That Away "" helped her get through rough emotional moments with her labels management, and even times when she felt overwhelmed by others.  During the early stages of the album, Carey said she felt pressured to complete the Rainbow album as quickly as possible, due to the fact that it was the last album under her contract with Columbia  ....",baseline,non-relevant,non-relevant,non-relevant,non-relevant
mariah-carey-place-of-birth-huntington.txt,"...  Mariah Carey:   Intro | children = 2| website = | module = }}Mariah Carey  is an American singer, songwriter, record producer, and actress.  In 1990, Carey rose to fame with the release of ""Vision of Love"" from her eponymous debut album  .  The album produced four chart-topping singles in the US and began what would become a string of commercially successful albums which solidified the singer as Columbia  s highest selling act....",baseline_with_expansion,non-relevant,non-relevant,non-relevant,non-relevant
mariah-carey-place-of-birth-huntington.txt,"...  Music of Long Island:    Pop:   For example, superstar diva Mariah Carey was born and raised in Huntington  in Suffolk County.  R B singer Ashanti  grew up in Glen Cove  .  Lou Reed grew up in Freeport, Paris-based singer-songwriter Elliott Murphy was raised in Garden City  ....",proposed,relevant,relevant,relevant,relevant
mariah-carey-spouse-nick-cannon.txt,"...  Hero :    Live performances:   On June 5, 2010, Carey performed the song alongside ""We Belong Together  "" at the Walmart shareholders meeting.  Following the performance, Carey gained heavy media coverage for her apparent weight gain, leading many to suspect her pregnancy with husband Nick Cannon.  Aside from the several live televised performances, Carey included ""Hero"" on the set-lists on all of her tours, usually serving as one of the closing numbers....",proposed,relevant,relevant,relevant,relevant
mariah-carey-spouse-nick-cannon.txt,"...Cannon received his first break doing stand-up comedy on his fathers local cable access program. Personal life Cannon married singer Mariah Carey on April 30, 2008, at her private estate on Windermere Island in The Bahamas.  On April 30, 2011, their third wedding anniversary, Carey gave birth to fraternal twins: daughter Monroe  and son Moroccan Scott, because Cannon proposed to Carey in her Moroccan-style room; Scott is Cannons middle name and his grandmothers maiden name.  Monroe, like her mother, has no middle name.  After six years of marriage, the pair separated, and Cannon filed for divorce in 2014, which was finalized in 2016....",baseline,relevant,relevant,relevant,relevant
mariah-carey-spouse-nick-cannon.txt,"...On April 30, 2011, their third wedding anniversary, Carey gave birth to fraternal twins: daughter Monroe  and son Moroccan Scott, because Cannon proposed to Carey in her Moroccan-style room; Scott is Cannons middle name and his grandmothers maiden name.  Monroe, like her mother, has no middle name.  After six years of marriage, the pair separated, and Cannon filed for divorce in 2014, which was finalized in 2016.  Following a brief relationship, Cannon had another child, son Golden ""Sagon"" Cannon, with Brittany Bell on February 21, 2017.  Cannon was hospitalized on January 4, 2012, for treatment of ""mild kidney failure"", and again on February 17 after a pulmonary embolism....",baseline,relevant,relevant,partial,relevant
mariah-carey-spouse-nick-cannon.txt,"...|-| align=""center"" rowspan=""3""| 1991  | rowspan=""5""| Mariah Carey| Favorite Pop/Rock Female Artist  | |-| Favorite Soul/R B Female Artist  | |-| New Artist of The Year| |-| align=""center"" rowspan=""3""| 1992  | Favorite Pop/Rock Female Artist| |-| Favorite Soul/R B Female Artist| |-| ""Someday""| Favorite Dance Single| |-| align=""center"" rowspan=""6""| 1993  | rowspan=""3""| Mariah Carey | Favorite Pop/Rock Female Artist| |- | Favorite Soul/R B Female Artist| |-| Favorite Adult Contemporary Artist  | |-| ""Ill Be There""| Favorite Pop/Rock Single| |-| rowspan=""2""| MTV Unplugged EP| Favorite Adult Contemporary Album  | |-| Favorite Soul/R B Album| |-| align=""center"" rowspan=""3""| 1994  | rowspan=""2""| Mariah Carey| Favorite Pop/Rock Female Artist| |-| Favorite Soul/R B Female Artist| |- | ""Dreamlover""| Favorite Soul/R B Single| |-| align=""center"" rowspan=""4""| 1995  | rowspan=""2""| Mariah Carey| Favorite Pop/Rock Female Artist| |-| Favorite Adult Contemporary Artist| |-| rowspan=""2""| Music Box| Favorite Pop/Rock Album| |-| Favorite Soul/R B Album| |-| align=""center"" rowspan=""2""| 1996  | rowspan=""5""| Mariah Carey| Favorite Pop/Rock Female Artist| |-| Favorite Soul/R B Female Artist| |-| align=""center"" rowspan=""5""| 1997  | Favorite Pop/Rock Female Artist| |-| Favorite Soul/R B Female Artist| |-| Favorite Adult Contemporary Artist| |-| rowspan=""2""| Daydream| Favorite Pop/Rock Album| |- | Favorite Soul/R B Album| |-| align=""center""| 1998  | rowspan=""4""| Mariah Carey| Favorite Soul/R B Female Artist| |-| align=""center""| 2000  | Lifetime Achievement Award| |-| align=""center"" rowspan=""4""| 2005  | Favorite Pop/Rock Female Artist| |-| Favorite Soul/R B Female Artist| |-| rowspan=""2""| The Emancipation Of Mimi| Favorite Pop/Rock Album| |-| Favorite Soul/R B Album| |-| align=""center"" rowspan=""3""| 2006  | rowspan=""2""| Mariah Carey| Favorite Pop/Rock Female Artist| |-| Favorite Soul/R B Female Artist| |-| The Emancipation Of Mimi| Favorite Soul/R B Album| |-| align=""center"" rowspan=""3""| 2008  | rowspan=""2""| Mariah Carey| Honorary Award| |-| Favorite Pop/Rock Female Artist| |-| E=MC²| Favorite Soul/R B Album| |- ARIA Music Awards The Australian Recording Industry Association Music Awards  is an annual series of awards nights celebrating the Australian music industry, put on by the Australian Recording Industry Association ....",baseline,non-relevant,non-relevant,non-relevant,non-relevant
mariah-carey-spouse-nick-cannon.txt,"...With the release of ""Touch My Body"" , Carey gained her 18th number-one single in the United States, more than any other solo artist  .  In 2012, the singer was ranked second on VH1s list of the ""100 Greatest Women in Music"".  Aside from her commercial accomplishments, Carey has won 5 Grammy Awards, 19 World Music Awards, 11 American Music Awards, and 14 Billboard Music Award  s and has been consistently credited with inspiring a generation of singers....",baseline,non-relevant,non-relevant,non-relevant,non-relevant
mariah-carey-spouse-nick-cannon.txt,...  List of awards and nominations received by Mariah Carey:    Do Something Awards:  The Do Something Awards recognise both young people making social change and individuals from the entertainment industry who have dedicated their time to activism and charity.  Carey was awarded alongside her husband Nick Cannon in 2012.  Mariah Carey  | Do Something Couple|. ...,proposed,relevant,relevant,relevant,relevant
mariah-carey-spouse-nick-cannon.txt,"...  Nick Cannon:   Intro | website = }}Nicholas Scott ""Nick"" Cannon  is an American rapper, actor, comedian, entrepreneur, record producer, radio and television personality.  On television, Cannon began as a teenager on All That before going on to host The Nick Cannon Show, Wild N Out, and Americas Got Talent.  He acted in the films Drumline  , Love Dont Cost a Thing  , and Roll Bounce....",baseline_with_expansion,non-relevant,non-relevant,non-relevant,non-relevant
mariah-carey-spouse-nick-cannon.txt,"...  Mariah Carey:    Personal life:   Carey was in a relationship with singer Luis Miguel from 1998 to 2001.  Carey met actor and comedian Nick Cannon while they shot her music video for her song ""Bye Bye  "" on an island off the coast of Antigua.  On April 30, 2008, Carey married Cannon in The Bahamas....",proposed,relevant,relevant,partial,relevant
mariah-carey-spouse-nick-cannon.txt,"...The term continues to be applied to a woman who has separated from her partner, and ceases to be applied to such a woman only when her marriage has come to an end, following a legally recognized divorce or the death of her spouse.  On the death of her partner, a wife is referred to as a widow, but not after she is divorced from her partner. The rights and obligations of a wife in relation to her partner and her status in the community and in law vary between cultures and have varied over time. Summary thumbnail  wedding ring and a single-diamond, gold-banded engagement ring....",baseline_with_expansion,non-relevant,non-relevant,non-relevant,non-relevant
mariah-carey-spouse-nick-cannon.txt,"...  Me. I Am Mariah... The Elusive Chanteuse:    Development:   Her husband Nick Cannon told Billboard  in May 2011 that Carey had already completed a good amount of recording for a new album, a few months before during her pregnancy: ""Shes planning on having a  new single  out this year.  Shes been working away, and we have a studio in the crib, and  the pregnancy  has totally inspired her on so many different levels. "" Additionally, Cannon confirmed that Carey was inspired by her debut self-titled album  and its follow-up, Emotions  ....",proposed,relevant,relevant,relevant,relevant
mariah-carey-spouse-nick-cannon.txt,"...  The Warning :   Intro ""The Warning"" is a hip hop  diss song  written and performed by American rapper Eminem and produced by Dr.  Dre as part of an ongoing conflict with Mariah Carey.  Throughout his career, Eminem claimed he once had a relationship with Carey, dating her for six months.  Carey, however, always denied the claim.  As a result, Eminem recorded a number of songs in which he rapped about the singer in a negative light, angered by her not admitting to seeing him....",baseline_with_expansion,non-relevant,non-relevant,non-relevant,non-relevant
mariah-carey-spouse-nick-cannon.txt,"...  Wife:   Intro A wife is a female partner  in a continuing marital relationship.  A wife may also be referred to as a spouse, which is a gender-neutral term.  The term continues to be applied to a woman who has separated from her partner, and ceases to be applied to such a woman only when her marriage has come to an end, following a legally recognized divorce or the death of her spouse.  On the death of her partner, a wife is referred to as a widow, but not after she is divorced from her partner....",baseline_with_expansion,non-relevant,non-relevant,non-relevant,non-relevant
mariah-carey-spouse-nick-cannon.txt,"...  Nick Cannon:   Intro | website = }}Nicholas Scott ""Nick"" Cannon  is an American rapper, actor, comedian, entrepreneur, record producer, radio and television personality.  On television, Cannon began as a teenager on All That before going on to host The Nick Cannon Show, Wild N Out, and Americas Got Talent.  He acted in the films Drumline  , Love Dont Cost a Thing  , and Roll Bounce....",baseline,non-relevant,non-relevant,non-relevant,non-relevant
mariah-carey-spouse-nick-cannon.txt,"...Marriages are more likely to be a product of mutual love, rather than economic necessity or a formal arrangement among families.  Remaining single by choice is increasingly viewed as socially acceptable and there is less pressure on young couples to marry.  Marriage is no longer obligatory.  Interracial marriage is no longer forbidden. Asia and Africa Key facts concerning the marriage law in Africa and Asia: Marital rape is legal in most parts Africa and Asia alike.  Child marriage is legal in most parts of Africa and Asia alike....",baseline_with_expansion,non-relevant,non-relevant,non-relevant,non-relevant
mariah-carey-spouse-nick-cannon.txt,"...  E=MC² :    Singles:   The song failed to chart on the Hot 100, though became Careys fourteenth chart topper on the Hot Dance Club Play.  Additionally, it peaked at number ninety-five on the UK Singles Chart.  The songs accompanying music video was filmed by Careys husband, Nick Cannon, and features Carey as a dancer in a Las Vegas show at the The Bellagio Hotel and Casino Resort  ....",proposed,relevant,relevant,relevant,relevant
mariah-carey-award-received-grammy-award-for-best-new-artist.txt,"...  Mariah Carey:    2005–2007: Resurgence with The Emancipation of Mimi:   In 2006 Carey won Best Contemporary R B Album  for The Emancipation of Mimi, as well as Best Female R B Vocal Performance  and Best R B Song  for ""We Belong Together. "" The Emancipation of Mimi was the best-selling album in the United States in 2005, with nearly five million units sold.  It was the first album by a solo female artist to become the years best-selling album since Alanis Morissettes Jagged Little Pill in 1996....",proposed,non-relevant,non-relevant,non-relevant,non-relevant
mariah-carey-award-received-grammy-award-for-best-new-artist.txt,"...H The nominations for the fragance M were presented to the company Elizabeth Arden. 2011 I The nominations for the fragance Lollipop Bling were presented to the company Elizabeth Arden. American Black Achievement Awards |-| align=""center""| 1991| Mariah Carey| The Music Award | |- American Music Awards The American Music Awards is an annual ceremony in the United States, with accolades awarded by way of public voting.  Mariah Carey has received 10 awards from 38 nominations....",baseline,non-relevant,relevant,non-relevant,non-relevant
mariah-carey-award-received-grammy-award-for-best-new-artist.txt,"...H The nominations for the fragance M were presented to the company Elizabeth Arden. 2011 I The nominations for the fragance Lollipop Bling were presented to the company Elizabeth Arden. American Black Achievement Awards |-| align=""center""| 1991| Mariah Carey| The Music Award | |- American Music Awards The American Music Awards is an annual ceremony in the United States, with accolades awarded by way of public voting.  Mariah Carey has received 10 awards from 38 nominations....",baseline,non-relevant,relevant,non-relevant,non-relevant
mariah-carey-award-received-grammy-award-for-best-new-artist.txt,"...shtml Mariah Awards]  Category:Mariah CareyCarey, Mariah  2002 Notes B Mariah received this nomination because of her performance of the song Hero  in the benefit concert America: A Tribute to Heroes. 2003 Notes E For over 100 million album sales worldwide and she was the first female ever to receive the award. 2006 Notes F This award was presented to EMI Music Publishing  for their 17 award-winning songs, including We Belong Together and Shake it off. 2008 Notes G Both ceremonies, AMA WWA, gave Mariah a Special Achievement Award for most # 1 singles  achieved by any female solo recording artist....",baseline,non-relevant,relevant,non-relevant,non-relevant
mariah-carey-award-received-grammy-award-for-best-new-artist.txt,"...  Ben Margulies:   Intro Ben Margulies is a Grammy-nominated songwriter and a RIAA  nine-time platinum certified record producer.  He is best known for co-writing, arranging, and producing Mariah Careys first album, Mariah Carey  . Early years Margulies began his musical career as a session drummer  for the New York new wave  trio Comateens, and joined their 1983 European tour to promote their Pictures on a String album....",baseline,partial,non-relevant,partial,partial
mariah-carey-award-received-grammy-award-for-best-new-artist.txt,"...  Mariah Carey:    Awards and honors:  Throughout Careys career, she has collected many honors and awards, including the World Music Awards Best Selling Female Artist of the Millennium, the Grammys Best New Artist in 1991, and Billboard  s Special Achievement Award for the Artist of the Decade during the 1990s.  In a career spanning over 20 years, Carey has sold over 200 million records worldwide, making her one of the biggest-selling artists  in music history.  Carey is ranked as the best-selling female artist of the Nielsen SoundScan era, with over 52 nbsp;million copies sold....",proposed,relevant,relevant,relevant,relevant
mariah-carey-award-received-grammy-award-for-best-new-artist.txt,"...  List of awards and nominations received by Mariah Carey:   Intro }} Mariah Carey has received many awards and accolades in recognition of her success in the music industry, among them; 5 Grammy Awards, 20 World Music Awards, 10 American Music Awards, 14 Billboard Music Awards  .  Below is a list of the awards she has received. External links  http://www. mariahdaily. com/info/awards. shtml Mariah Carey Awards   http://www. rockonthenet. com/amas/index. htm American Music Awards History  [http://www....",baseline_with_expansion,relevant,relevant,partial,relevant
mariah-carey-award-received-grammy-award-for-best-new-artist.txt,"...  Mariah Carey:    1988–1992: Mariah Carey and Emotions:   After the completion of her debut album, Mariah Carey  , Columbia spent more than $1 million promoting it.  Despite a weak start, the album eventually reached the top of the Billboard 200  , after Careys exposure at the 33rd Annual Grammy Awards.  Mariah Carey stayed atop the charts for eleven consecutive weeks, and she won the Best New Artist  , and Best Female Pop Vocal Performance  awards for her single ""Vision of Love....",proposed,relevant,partial,partial,partial
mariah-carey-award-received-grammy-award-for-best-new-artist.txt,"..., and brother of Branford  , Delfeayo  , and Jason  .  Marsalis performed the national anthem at Super Bowl XX in 1986. Life and career Marsalis was born in New Orleans, Louisiana, on October 18, 1961, the second of six sons of Delores  and Ellis Louis Marsalis, Jr.   , a pianist and music professor.  Marsalis brothers are: Branford Marsalis, Ellis Marsalis III , Delfeayo Marsalis, Mboya Kinyatta Marsalis , and Jason Marsalis....",baseline_with_expansion,non-relevant,non-relevant,non-relevant,non-relevant
mariah-carey-award-received-grammy-award-for-best-new-artist.txt,"...  Mariah Carey:    1993–1996: Music Box and Daydream:   Due to the albums success, Carey won two awards at the American Music Awards for her solo efforts: Favorite Pop/Rock Female Artist  and Favorite Soul/R B Female Artist  .  Daydream and its singles were respectively nominated in six categories at the 38th Grammy Awards.  Carey, along with Boyz II Men, opened the event with a performance of ""One Sweet Day....",proposed,partial,relevant,non-relevant,non-relevant
mariah-carey-award-received-grammy-award-for-best-new-artist.txt,"...H The nominations for the fragance M were presented to the company Elizabeth Arden. 2011 I The nominations for the fragance Lollipop Bling were presented to the company Elizabeth Arden. American Black Achievement Awards |-| align=""center""| 1991| Mariah Carey| The Music Award | |- American Music Awards The American Music Awards is an annual ceremony in the United States, with accolades awarded by way of public voting.  Mariah Carey has received 10 awards from 38 nominations....",baseline_with_expansion,partial,partial,non-relevant,partial
