Query,Passage,Method,Judge_1,Judge_2,Judge_3,Final
steve-bannon-position-held-white-house-chief-strategist.txt,"...  First 100 days of Donald Trump's presidency:    White House Chief Strategist:   Mike Pence affirmed in a PBS NewsHour report that only Trump was ""in charge"". Bannon and Steve Miller have been called the ""architects"" of the inaugural address, executive orders, including the controversial travel and refugees EO, and presidential memoranda.  In an often-cited October 8, 2015, lengthy profile entitled ""This Man Is the Most Dangerous Political Operative in America"" by Joshua Green  , a senior national correspondent for Bloomberg News, Green described how Breitbart News with Bannon at its helm, had ""championed Trumps presidential candidacy"" and helped ""coalesce a splinter faction of conservatives"" who were irate over the way in which Fox News had treated Trump....",proposed,relevant,non-relevant,non-relevant,non-relevant
steve-bannon-position-held-white-house-chief-strategist.txt,"...After the election, Vice President-elect Mike Pence replaced Christie as chairman of the transition team, while Christie became a vice-chairman alongside Senator Jeff Sessions of Alabama, retired Army Lt.  Gen.  Michael T.  Flynn, former New York City Mayor Rudy Giuliani, former presidential candidate Ben Carson, and former House Speaker Newt Gingrich.  Trumps transition team launched the website Greatagain. gov.  Trump and his transition team began choosing key personnel for his administration following his election victory.  Trump was inaugurated  on January 20, 2017, shortly after Pence was inaugurated as vice president....",baseline_with_expansion,non-relevant,non-relevant,non-relevant,non-relevant
steve-bannon-position-held-white-house-chief-strategist.txt,"...  Steve Bannon:    Intro:  |birth_place = Norfolk, Virginia, U. S. |death_date =|death_place =|party = Republican  |spouse = Cathleen Houff Jordan Mary Piccard Diane Clohesy |children = 3|education = Virginia Tech Georgetown University Harvard University |allegiance = |branch = |serviceyears = 1976–1983|rank = Lieutenant   }}Stephen Kevin ""Steve"" Bannon  is an American political aide, and former media executive and film producer, who is currently the White House Chief Strategist in the Trump  administration.  In this capacity, he attended the Principals Committee of the U. S....",proposed,relevant,relevant,relevant,relevant
steve-bannon-position-held-white-house-chief-strategist.txt,"...  White House Office:   Intro The White House Office is an entity within the Executive Office of the President of the United States.  The White House Office is headed by the White House Chief of Staff, who is also the head of the Executive Office.  The staff of the various offices are based in the West Wing and East Wing of the White House, the Eisenhower Executive Office Building, and the New Executive Office Building.  It is made up of personal assistants to the president with offices in the White House....",baseline_with_expansion,non-relevant,non-relevant,non-relevant,non-relevant
steve-bannon-position-held-white-house-chief-strategist.txt,"...  Timeline of protests against Donald Trump:    Post-election protests:    November 17 : In the early morning in Los Angeles, protesters chanted ""Fire Bannon"" in reference to Trump appointing Steve Bannon as chief White House strategist and senior counselor on Sunday.  Bannon denied accusations of his being a white nationalist, saying ""Im a nationalist. "" : Two students were arrested at a protest at the University of Pittsburgh : A rally was held at the University of Miami : Around 100 students protested at Portland State University  November 18 : Various protests occurred in Augusta, Maine, Chapel Hill, North Carolina, Cleveland, Ohio, Prince Georges County, Maryland, Sacramento, California, and Washington, D. C....",proposed,relevant,relevant,relevant,relevant
steve-bannon-position-held-white-house-chief-strategist.txt,"...G. ), the head of the Justice Department  were confirmed by the Senate.  By this time in the first 100 Days of Obamas Presidency in 2009, all but one had been confirmed, and in 2001 in George W.  Bushs all had been confirmed.  Trumps nominees for the departments of Treasury, Agriculture, Commerce, Energy, Health and Human Services, Housing and Urban Development, Interior, Labor, and Veterans Affairs had not yet been confirmed on February 7.  By February 8, 2017, President Trump had fewer cabinet nominees confirmed than any other president except George Washington by the same length of time into his presidency....",baseline_with_expansion,non-relevant,non-relevant,non-relevant,non-relevant
steve-bannon-position-held-white-house-chief-strategist.txt,"...  Steve Bannon:   Intro |birth_place = Norfolk, Virginia, U. S. |death_date =|death_place =|party = Republican  |spouse = Cathleen Houff Jordan Mary Piccard Diane Clohesy |children = 3|education = Virginia Tech Georgetown University Harvard University |allegiance = |branch = |serviceyears = 1976–1983|rank = Lieutenant   }}Stephen Kevin ""Steve"" Bannon  is an American political aide, and former media executive and film producer, who is currently the White House Chief Strategist in the Trump  administration....",baseline_with_expansion,relevant,relevant,relevant,relevant
steve-bannon-position-held-white-house-chief-strategist.txt,"...After the election, Vice President-elect Mike Pence replaced Christie as chairman of the transition team, while Christie became a vice-chairman alongside Senator Jeff Sessions of Alabama, retired Army Lt.  Gen.  Michael T.  Flynn, former New York City Mayor Rudy Giuliani, former presidential candidate Ben Carson, and former House Speaker Newt Gingrich.  Trumps transition team launched the website Greatagain. gov.  Trump and his transition team began choosing key personnel for his administration following his election victory.  Trump was inaugurated  on January 20, 2017, shortly after Pence was inaugurated as vice president....",baseline,non-relevant,non-relevant,non-relevant,non-relevant
steve-bannon-position-held-white-house-chief-strategist.txt,...  White House Chief Strategist:   Intro The White House Chief Strategist is one of the Presidents closest advisors working to execute the administrations long-term agenda and providing counsel to the President on all critical matters....,baseline_with_expansion,non-relevant,non-relevant,non-relevant,non-relevant
steve-bannon-position-held-white-house-chief-strategist.txt,"...  Michael Voris:    Detroit Free Press, USA Today, Americans United:   And if that policy is favorable to the church, well then, very good. "" The article held that ""Many of Church Militants headlines are similar to those on Breitbart News, the far-right news organization that White House Chief Strategist Steve Bannon previously ran. "" It noted ""Many of Breitbarts articles are cited on the Church Militant website....",proposed,relevant,non-relevant,non-relevant,non-relevant
george-h.-w.-bush-residence-houston.txt,"...  Barbara Bush:    Life after the White House:  Since leaving the White House, she and her husband reside in the River Oaks community in Houston, Texas  and at the Bush compound in Kennebunkport, Maine.  Bush described January 20, 1993, the day of Bill Clintons inauguration, a ""tough day"" for her and George.  After returning to Houston, the two were visited by their son George W....",proposed,relevant,relevant,relevant,relevant
george-h.-w.-bush-residence-houston.txt,"...Mimi Swartz of National Geographic  wrote that compared to River Oaks  , West Oaks is ""more nondescript"".  Beginning in the 1990s, George H.  W.  Bush became a resident of the neighborhood. Cityscape As of 1992 West Oaks had 30 houses on fairly large lots.  Claudia Feldman of the Houston Chronicle said in 1992 that West Oaks and West Oaks Drive South ""are nifty, like pages out of a New England tour guide. "" Herbert Wells, an interior designer from Connecticut who lived in West Oaks and was quoted in Feldmans article, said that the area was ""charming"" and reminded him of his home state....",baseline,relevant,non-relevant,non-relevant,non-relevant
george-h.-w.-bush-residence-houston.txt,"...For the first six months, no houses were sold in Tanglewood.  Mary Catherine, who later took the family name Miller, said that the lack of sales caused stress for the family.  After several heavy rainstorms resulted in floods that affected other areas in Harris County  , potential buyers began inquiring about buying houses in Tanglewood because they heard that the neighborhood had high water drainage capabilities. Geography Tanglewood is within a several minute driving distance of Downtown Houston.  The area has around 5,000 trees....",baseline,non-relevant,non-relevant,non-relevant,non-relevant
george-h.-w.-bush-residence-houston.txt,"...  The Houstonian Hotel:   Intro The Houstonian}}The Houstonian Hotel, Club Spa is a luxury hotel located in Houston, nbsp;Texas  .  The 18-acre campus includes a hotel and conference center, several restaurants, spa and health and fitness center. History The developer of the Houstonian Hotel was Tom Fatjo, a Houstonian who had also founded Browning-Ferris Industries .  The hotel opened in 1980....",baseline,non-relevant,non-relevant,non-relevant,non-relevant
george-h.-w.-bush-residence-houston.txt,"...After several heavy rainstorms resulted in floods that affected other areas in Harris County  , potential buyers began inquiring about buying houses in Tanglewood because they heard that the neighborhood had high water drainage capabilities. Geography Tanglewood is within a several minute driving distance of Downtown Houston.  The area has around 5,000 trees.  Before the subdivision was developed, Tanglewood was a coastal prairie  that experienced regular grass fires, preventing the growth of trees.  After Tanglewood was built, wildfires were suppressed....",baseline,non-relevant,non-relevant,non-relevant,non-relevant
george-h.-w.-bush-residence-houston.txt,"...  George H. W. Bush:    Congressional years :   As Bushs political career waned, he moved out of Houston and sold his first Tanglewood house, but for periods of time continued to reside in Tanglewood.  Yarborough endorsed Bentsen, who defeated Bush, 53. 4 to 46.  Yarborough endorsed Bentsen, who defeated Bush, 53....",proposed,relevant,non-relevant,non-relevant,non-relevant
george-h.-w.-bush-residence-houston.txt,"...The 18-acre campus includes a hotel and conference center, several restaurants, spa and health and fitness center. History The developer of the Houstonian Hotel was Tom Fatjo, a Houstonian who had also founded Browning-Ferris Industries .  The hotel opened in 1980.  George Alexander of the Houston Press said that the hotel was ""built as a health club for business executives trying to shed pounds and rediscover their inner velociraptor"". Meeting services The hotel is designed to accommodate meetings, which as of 2004 generate half of the hotels business.  Mark Lupton, the director of sales, said in 2004 that ""The Houstonian is a little different than normal places....",baseline_with_expansion,non-relevant,non-relevant,non-relevant,non-relevant
george-h.-w.-bush-residence-houston.txt,"...  George H. W. Bush:    Congressional years :   Bush was the first Republican to represent Houston in the U. S.  House.  Bushs representative district included Tanglewood  , the Houston neighborhood that was his residence; his family had moved into Tanglewood in the 1960s.  His voting record in the House was generally conservative  : Bush voted for the Civil Rights Act of 1968, although it was generally unpopular in his district....",proposed,relevant,relevant,relevant,relevant
george-h.-w.-bush-residence-houston.txt,"...After several heavy rainstorms resulted in floods that affected other areas in Harris County  , potential buyers began inquiring about buying houses in Tanglewood because they heard that the neighborhood had high water drainage capabilities. Geography Tanglewood is within a several minute driving distance of Downtown Houston.  The area has around 5,000 trees.  Before the subdivision was developed, Tanglewood was a coastal prairie  that experienced regular grass fires, preventing the growth of trees.  After Tanglewood was built, wildfires were suppressed....",baseline_with_expansion,non-relevant,non-relevant,non-relevant,non-relevant
george-h.-w.-bush-residence-houston.txt,"...  George H. W. Bush:    First term, 1981–85:   As had become customary, he and his wife moved into the Vice Presidents residence at Number One Observatory Circle, about two miles from the White House.  After selling the house in Tanglewood  , the Bushes declared a room in The Houstonian Hotel in Houston as their official voting address.  The Bushes attended a large number of public and ceremonial events in their positions, including many state funerals, which became a common joke for comedians.  Mrs....",proposed,relevant,relevant,non-relevant,relevant
george-h.-w.-bush-residence-houston.txt,"...  West Oaks, Houston:   Intro West Oaks is a small subdivision in Houston, Texas.  It is east of, and in close proximity to, Tanglewood  proper.  Mimi Swartz of National Geographic  wrote that compared to River Oaks  , West Oaks is ""more nondescript"".  Beginning in the 1990s, George H.  W.  Bush became a resident of the neighborhood. Cityscape As of 1992 West Oaks had 30 houses on fairly large lots....",baseline_with_expansion,relevant,non-relevant,non-relevant,non-relevant
george-h.-w.-bush-residence-houston.txt,"...For the first six months, no houses were sold in Tanglewood.  Mary Catherine, who later took the family name Miller, said that the lack of sales caused stress for the family.  After several heavy rainstorms resulted in floods that affected other areas in Harris County  , potential buyers began inquiring about buying houses in Tanglewood because they heard that the neighborhood had high water drainage capabilities. Geography Tanglewood is within a several minute driving distance of Downtown Houston.  The area has around 5,000 trees....",baseline_with_expansion,non-relevant,non-relevant,non-relevant,non-relevant
george-h.-w.-bush-residence-houston.txt,"...The 18-acre campus includes a hotel and conference center, several restaurants, spa and health and fitness center. History The developer of the Houstonian Hotel was Tom Fatjo, a Houstonian who had also founded Browning-Ferris Industries .  The hotel opened in 1980.  George Alexander of the Houston Press said that the hotel was ""built as a health club for business executives trying to shed pounds and rediscover their inner velociraptor"". Meeting services The hotel is designed to accommodate meetings, which as of 2004 generate half of the hotels business.  Mark Lupton, the director of sales, said in 2004 that ""The Houstonian is a little different than normal places....",baseline,non-relevant,non-relevant,non-relevant,non-relevant
george-h.-w.-bush-residence-houston.txt,"...  The Houstonian Hotel:   Intro The Houstonian}}The Houstonian Hotel, Club Spa is a luxury hotel located in Houston, nbsp;Texas  .  The 18-acre campus includes a hotel and conference center, several restaurants, spa and health and fitness center. History The developer of the Houstonian Hotel was Tom Fatjo, a Houstonian who had also founded Browning-Ferris Industries .  The hotel opened in 1980....",baseline_with_expansion,non-relevant,non-relevant,non-relevant,non-relevant
george-h.-w.-bush-residence-houston.txt,"...  George H. W. Bush:    Post-presidency :   Mimi Swartz of National Geographic  wrote that ""The Bushes are too studiously sedate to live in River Oaks  "".  They spend the summer at Walkers Point  in Kennebunkport, Maine.  On January 10, 1999, the Bushes became the longest-married Presidential couple in history, outlasting John  and Abigail Adams, who were married for 54 years and 3 days....",proposed,non-relevant,non-relevant,relevant,non-relevant
jolly-llb-2-cast-member-akshay-kumar.txt,"...  Jolly LLB 2:    Cast:  Akshay Kumar as Jagdishwar Mishra  Huma Qureshi  as Pushpa Pandey Saurabh Shukla as Justice Sunderlal Tripathi Annu Kapoor as Pramod Mathur Kaustubh Pile as Mathurs 3rd assistant Manav Kaul as Iqbal Qasim Inaamulhaq as Mohammed Iqbal Quadri Kumud Mishra as Inspector Suryaveer Singh Sayani Gupta as Hina Siddiqui Sanjay Mishra  as Guru Ji Vinod Nagpal as Zahoor Siddiqui  Brijendra Kala as Dubey Ji  Avijit Dutt as V. K.  Paul, a Police Commissioner Rajiv Gupta as Birbal Sunil Kumar Palwal as Fahim Butt, a Kashmir Police Constable  Shubhangi Latkar  M. K.  Raina  Paul, a Police Commissioner Rajiv Gupta as Birbal Sunil Kumar Palwal as Fahim Butt, a Kashmir Police Constable  Shubhangi Latkar  M. K....",proposed,relevant,relevant,relevant,relevant
jolly-llb-2-cast-member-akshay-kumar.txt,"...He loses control and crashes into a wall on the footpath by the road.  The film cuts to a court scene where Jagdish Tyagi a. k. a.  Jolly , an LLB  graduate defending a surgeon against a Public interest litigation   filed against him after the surgeon had his son operate upon a patient in his pursuit of Guinness Book of World Records.  Jolly loses the case but decides to move to the capital Delhi to try his luck.  He happens to see prominent criminal lawyer Tejinder Rajpal  defending Rahul Dewan in a sessions court....",baseline,non-relevant,non-relevant,non-relevant,non-relevant
jolly-llb-2-cast-member-akshay-kumar.txt,"...In order to arrange money for his own chamber, Jolly lies to a pregnant lady, Hina  and convinces her to give him rupees 2 Lakh as fees so that Rizvi Sahab would fight her case.  Jolly uses that money to pay the final payment for his own chamber and opens it with a ceremony.  When Hina finds out that she has been bluffed by Jolly, she commits suicide.  Everyone blames Jolly for her death, including Jollys father, who worked for 30 years as a clerk for Rizvi Sahab.  Filled with guilt, Jolly along with his wife Pushpa  }} ) fellow lawyer Birbal , decides to fight Hinas case files a PIL  ....",baseline,non-relevant,non-relevant,non-relevant,non-relevant
jolly-llb-2-cast-member-akshay-kumar.txt,"...  Akshay Kumar:   Intro Rajiv Hari Om Bhatia , better known by his stage name Akshay Kumar, is an Indian-born Canadian  actor, producer and martial artist  who has appeared in over a hundred  Hindi films  .  Kumar won the National Film Award for Best Actor for his performance in Rustom  and he has been nominated for Filmfare Awards several times, winning it two times  ....",baseline,non-relevant,non-relevant,non-relevant,non-relevant
jolly-llb-2-cast-member-akshay-kumar.txt,"...  Jolly LLB :   Intro | gross = }}Jolly LLB is a series of Indian Hindi-language courtroom  black comedy-drama film, written and directed by Subhash Kapoor and produced by Vijay Singh, under Fox Star Studios. Remake 2013 film Jolly LLB has been remade into Tamil film Manithan  in 2016. Jolly LLB  The film begins with a drunk Rahul Dewan , racing in a Toyota Land Cruiser Prado against a Mercedes, after he is seduced by a woman in the passenger seat.  He loses control and crashes into a wall on the footpath by the road.  The film cuts to a court scene where Jagdish Tyagi a. k. a.  Jolly , an LLB  graduate defending a surgeon against a Public interest litigation   filed against him after the surgeon had his son operate upon a patient in his pursuit of Guinness Book of World Records....",baseline,non-relevant,relevant,non-relevant,non-relevant
jolly-llb-2-cast-member-akshay-kumar.txt,"...  Jolly LLB 2:    Intro:  25 crore }}The State vs Jolly LL. B 2, known also as Jolly LL. B 2, is a 2017 Indian black comedy film, written and directed by Subhash Kapoor.  A sequel to the 2013 film Jolly LLB, and the second installment of Jolly LLB .  The film stars Akshay Kumar, Huma Qureshi  , Saurabh Shukla and Annu Kapoor in lead roles....",proposed,relevant,relevant,relevant,relevant
jolly-llb-2-cast-member-akshay-kumar.txt,"...  Jolly LLB 2:   Intro 30 crore | gross = 197. 25 crore }}The State vs Jolly LL. B 2, known also as Jolly LL. B 2, is a 2017 Indian black comedy film, written and directed by Subhash Kapoor.  A sequel to the 2013 film Jolly LLB, and the second installment of Jolly LLB .  The film stars Akshay Kumar, Huma Qureshi  , Saurabh Shukla and Annu Kapoor in lead roles.  A courtroom drama which satirizes the notion of the Indian legal system, the story follows Jagdishwar Mishra , a lawyer who fights a case against the ruthless and powerful lawyer Pramod Mathur . Plot Jagdishwar Mishra a....",baseline_with_expansion,relevant,relevant,relevant,relevant
jolly-llb-2-cast-member-akshay-kumar.txt,"...  Jolly LLB 2:    Intro:   A sequel to the 2013 film Jolly LLB, and the second installment of Jolly LLB .  The film stars Akshay Kumar, Huma Qureshi  , Saurabh Shukla and Annu Kapoor in lead roles.  A courtroom drama which satirizes the notion of the Indian legal system, the story follows Jagdishwar Mishra , a lawyer who fights a case against the ruthless and powerful lawyer Pramod Mathur . ...",proposed,relevant,relevant,relevant,relevant
jolly-llb-2-cast-member-akshay-kumar.txt,"...  Akshay Kumar:   Intro Rajiv Hari Om Bhatia , better known by his stage name Akshay Kumar, is an Indian-born Canadian  actor, producer and martial artist  who has appeared in over a hundred  Hindi films  .  Kumar won the National Film Award for Best Actor for his performance in Rustom  and he has been nominated for Filmfare Awards several times, winning it two times  ....",baseline_with_expansion,non-relevant,non-relevant,non-relevant,non-relevant
jolly-llb-2-cast-member-akshay-kumar.txt,"...  Jolly LLB :    Jolly LLB 2 :  Jagdishwar Mishra a. k. a Jolly  is a Lucknow based lawyer who works as an assistant  to one of the most famous lawyers of Lucknow, Rizvi Sahab.  He hails from Kanpur.  In order to arrange money for his own chamber, Jolly lies to a pregnant lady, Hina  and convinces her to give him rupees 2 Lakh as fees so that Rizvi Sahab would fight her case....",proposed,non-relevant,non-relevant,non-relevant,non-relevant
jolly-llb-2-cast-member-akshay-kumar.txt,"...  Inaamulhaq:   Intro Inaamulhaq  is an Indian actor and screenwriter who has appeared in Bollywood films, including Filmistaan and Airlift . He has written for TV shows including Comedy Circus and dialogue for the Hindi film Bbuddah.  Hoga Terra Baap. Early life and career Born in Saharanpur , Inaamulhaq first appeared on stage at the age of twelve.  Later, he joined the Indian People’s Theatre Association  in Saharanpur, and acted in numerous plays as a lead....",baseline_with_expansion,non-relevant,non-relevant,non-relevant,non-relevant
jolly-llb-2-cast-member-akshay-kumar.txt,"...In order to arrange money for his own chamber, Jolly lies to a pregnant lady, Hina  and convinces her to give him rupees 2 Lakh as fees so that Rizvi Sahab would fight her case.  Jolly uses that money to pay the final payment for his own chamber and opens it with a ceremony.  When Hina finds out that she has been bluffed by Jolly, she commits suicide.  Everyone blames Jolly for her death, including Jollys father, who worked for 30 years as a clerk for Rizvi Sahab.  Filled with guilt, Jolly along with his wife Pushpa  }} ) fellow lawyer Birbal , decides to fight Hinas case files a PIL  ....",baseline_with_expansion,non-relevant,non-relevant,non-relevant,non-relevant
jolly-llb-2-cast-member-akshay-kumar.txt,"...  Jolly LLB 2:   Intro 30 crore | gross = 197. 25 crore }}The State vs Jolly LL. B 2, known also as Jolly LL. B 2, is a 2017 Indian black comedy film, written and directed by Subhash Kapoor.  A sequel to the 2013 film Jolly LLB, and the second installment of Jolly LLB .  The film stars Akshay Kumar, Huma Qureshi  , Saurabh Shukla and Annu Kapoor in lead roles.  A courtroom drama which satirizes the notion of the Indian legal system, the story follows Jagdishwar Mishra , a lawyer who fights a case against the ruthless and powerful lawyer Pramod Mathur . Plot Jagdishwar Mishra a....",baseline,relevant,relevant,relevant,relevant
jolly-llb-2-cast-member-akshay-kumar.txt,"...He loses control and crashes into a wall on the footpath by the road.  The film cuts to a court scene where Jagdish Tyagi a. k. a.  Jolly , an LLB  graduate defending a surgeon against a Public interest litigation   filed against him after the surgeon had his son operate upon a patient in his pursuit of Guinness Book of World Records.  Jolly loses the case but decides to move to the capital Delhi to try his luck.  He happens to see prominent criminal lawyer Tejinder Rajpal  defending Rahul Dewan in a sessions court....",baseline_with_expansion,non-relevant,non-relevant,non-relevant,non-relevant
jolly-llb-2-cast-member-akshay-kumar.txt,"...  Jolly LLB 2:    Cast:   Paul, a Police Commissioner Rajiv Gupta as Birbal Sunil Kumar Palwal as Fahim Butt, a Kashmir Police Constable  Shubhangi Latkar  M. K.  Paul, a Police Commissioner Rajiv Gupta as Birbal Sunil Kumar Palwal as Fahim Butt, a Kashmir Police Constable  Shubhangi Latkar  M. Akshay Kumar as Jagdishwar Mishra  Huma Qureshi  as Pushpa Pandey Saurabh Shukla as Justice Sunderlal Tripathi Annu Kapoor as Pramod Mathur Kaustubh Pile as Mathurs 3rd assistant Manav Kaul as Iqbal Qasim Inaamulhaq as Mohammed Iqbal Quadri Kumud Mishra as Inspector Suryaveer Singh Sayani Gupta as Hina Siddiqui Sanjay Mishra  as Guru Ji Vinod Nagpal as Zahoor Siddiqui  Brijendra Kala as Dubey Ji  Avijit Dutt as V. ...",proposed,relevant,non-relevant,relevant,relevant
