Query,Passage,Method,Judge_1,Judge_2,Judge_3,Final
h.-r.-mcmaster-educated-at-united-states-military-academy.txt,"...The university is a member-school of the University of Louisiana System and Thurgood Marshall College Fund. History Grambling State was founded in 1901 and accredited in 1949.  The school became Grambling College in 1946 named after a white sawmill owner, Judson H.  Grambling, who donated a parcel of land for the school to be constructed.  With the addition of graduate departments, Grambling gained university status in 1974.  Grambling State University emerged from the desire of African-American farmers in rural north Louisiana who wanted to educate other African Americans in the northern part of the state....",baseline_with_expansion,non-relevant,non-relevant,non-relevant,non-relevant
h.-r.-mcmaster-educated-at-united-states-military-academy.txt,"...Kaimuki High School falls under the jurisdiction of the Hawaii Department of Education.  It is bordered by the Manoa-Palolo Drainage Canal, Kapiolani Boulevard, Kaimuki Avenue, Crane Park and Date Street.  It is, as its alma mater states, in view of Diamond Head.  The campus boasts the sculpture Pueo  by Charles W.  Watson. History During World War II when schools were allowed to reopen, a McKinley Annex  was started in Kaimuki Intermediate School for sophomores and juniors residing in that part of the city.  These students went to school in the afternoon from 12:20 nbsp;p....",baseline_with_expansion,non-relevant,non-relevant,non-relevant,non-relevant
h.-r.-mcmaster-educated-at-united-states-military-academy.txt,"...  Valley Forge Military Academy and College:    Military:   Lord, Major General, United States Army  Herbert Raymond McMaster  - Current National Security Advisor.  Lieutenant General, United States Army: historian, author, and former commander of the 3rd Armored Cavalry Regiment  during Operation Iraqi Freedom Harry J....",proposed,non-relevant,non-relevant,relevant,non-relevant
h.-r.-mcmaster-position-held-national-security-advisor.txt,"...  K. T. McFarland:    Trump administration:   While morale is higher in the NSC with McMaster, McFarland has been seen as a weak deputy internally, according to an NSC source. "" On April 9, 2017 it was reported that McFarland had been asked to step down from her position as Deputy National Security Advisor, after less than 3 months in it, and had been offered a position as the United States Ambassador to Singapore.  The move came about as the result of the desires of both McMaster and U. S....",proposed,relevant,non-relevant,partial,non-relevant
h.-r.-mcmaster-position-held-national-security-advisor.txt,"...As a result she has sometimes been thought of as a Kissinger protégée, but this is not a consistent view.  After the Ford administration left office, and with a desire as she later said to be ""taken really seriously,"" Troia by dint of a scholarship studied at Oxford University.  There, The New York Times inaccurately says, she earned a combined masters degree in Politics, Philosophy, and Economics.  More accurately, it was a combined bachelors degree.  Then she went to the Massachusetts Institute of Technology where she undertook concentrations on nuclear weapons, China, and the Soviet Union....",baseline,non-relevant,non-relevant,non-relevant,non-relevant
h.-r.-mcmaster-position-held-national-security-advisor.txt,"...Since its inception under Harry S.  Truman, the function of the Council has been to advise and assist the president on national security and foreign policies.  The Council also serves as the presidents principal arm for coordinating these policies among various government agencies.  The Council has counterparts in the national security councils of many other nations. History The National Security Council was created in 1947 by the National Security Act  ....",baseline,non-relevant,non-relevant,non-relevant,non-relevant
h.-r.-mcmaster-position-held-national-security-advisor.txt,"...He went to high school at Valley Forge Military Academy, graduating in 1980.  He earned a commission as a second lieutenant upon graduating from the United States Military Academy at West Point in 1984.  McMaster earned a Master of Arts and Ph. D.   in American history from the University of North Carolina at Chapel Hill .  His thesis was critical of American strategy in the Vietnam War, which was further detailed in his 1997 book Dereliction of Duty  . Military career His first assignment after commissioning was to the 2nd Armored Division {{ U. S....",baseline,non-relevant,non-relevant,non-relevant,non-relevant
h.-r.-mcmaster-position-held-national-security-advisor.txt,"...His thesis was critical of American strategy in the Vietnam War, which was further detailed in his 1997 book Dereliction of Duty  . Military career His first assignment after commissioning was to the 2nd Armored Division  at Fort Hood, where he served in a variety of platoon and company  level leadership assignments with 1st Battalion 66th Armor Regiment  ....",baseline,non-relevant,non-relevant,non-relevant,non-relevant
h.-r.-mcmaster-position-held-national-security-advisor.txt,"...  MacMaster :    Intro:   McMaster  an American soldier and National Security Advisor designate to the US President Donald Trump James McMaster 19th-century American newspaper editor, changed spelling from MacMaster to appeal to Irish readers Ken MacMaster , Canadian politician Mary Macmaster , Scottish musician Natalie MacMaster , Canadian fiddler Sherman McMaster , American outlaw and law-enforcement officer  McMaster , District Judge in the 179th Criminal Court in Harris County, Texas H....",proposed,relevant,non-relevant,relevant,relevant
h.-r.-mcmaster-position-held-national-security-advisor.txt,...These aides oversee the political and policy interests of the president and do not require Senate confirmation for appointment.  They can be removed at the discretion of the president  History Established in the Executive Office of the President by Reorganization Plan 1 of 1939 and to provide assistance to the President in the performance of his many detailed activities incident to his immediate office.  The White House Office is organized in accordance with the wishes of each incumbent President and is directed by staff chosen by the President....,baseline_with_expansion,non-relevant,non-relevant,non-relevant,non-relevant
h.-r.-mcmaster-position-held-national-security-advisor.txt,"...  H. R. McMaster:    Intro:  Herbert Raymond ""H.  R. "" McMaster  is a United States Army officer and currently the U. S.  National Security Advisor  ....",proposed,relevant,relevant,relevant,relevant
h.-r.-mcmaster-position-held-national-security-advisor.txt,"...The White House Office is organized in accordance with the wishes of each incumbent President and is directed by staff chosen by the President.  A staff authorization was initially established in 1978 .  Some presidential boards, committees, and commissions function organizationally as subunits of the White House Office....",baseline_with_expansion,non-relevant,non-relevant,non-relevant,non-relevant
h.-r.-mcmaster-position-held-national-security-advisor.txt,...  Presidency of Donald Trump:    Notable non-Cabinet positions:  White House staff Chief Strategist   Steve Bannon   Counselor to the President Kellyanne Conway   Senior Advisor to the President   Stephen Miller    Jared Kushner   Deputy Chiefs of Staff   Katie Walsh    Joe Hagin   Rick Dearborn   Press Secretary   Sean Spicer   Communications Director   Sean Spicer  Michael Dubke  Director of Strategic Communications   Hope Hicks   Security and international affairs National Security Advisor   Mike Flynn    Keith Kellogg  Herbert Raymond McMaster    Homeland Security Advisor Tom Bossert   Director of the FBI   James Comey 1      Domestic affairs Chair of the Council of Economic Advisers Vacant  Chair of the Securities and Exchange Commission {{ U. S....,proposed,relevant,relevant,relevant,relevant
h.-r.-mcmaster-position-held-national-security-advisor.txt,...  Ezra Cohen-Watnick:   Intro Ezra Asa Cohen-Watnick  is the Senior Director for Intelligence Programs for the United States National Security Council . Early life and career Cotnick-Watnick was born to Marc Cohen and Terry Watnick....,baseline_with_expansion,non-relevant,non-relevant,relevant,non-relevant
h.-r.-mcmaster-position-held-national-security-advisor.txt,"...  Keith Kellogg:   Intro Joseph Keith Kellogg Jr.  , known as Keith Kellogg, is a retired Lieutenant General  in the United States Army who is currently serving as the Chief of Staff of the United States National Security Council in the Trump administration  ....",baseline_with_expansion,non-relevant,non-relevant,non-relevant,non-relevant
h.-r.-mcmaster-position-held-national-security-advisor.txt,"...  Keith Kellogg:   Intro Joseph Keith Kellogg Jr.  , known as Keith Kellogg, is a retired Lieutenant General  in the United States Army who is currently serving as the Chief of Staff of the United States National Security Council in the Trump administration  ....",baseline,non-relevant,non-relevant,non-relevant,non-relevant
h.-r.-mcmaster-position-held-national-security-advisor.txt,"...As a result she has sometimes been thought of as a Kissinger protégée, but this is not a consistent view.  After the Ford administration left office, and with a desire as she later said to be ""taken really seriously,"" Troia by dint of a scholarship studied at Oxford University.  There, The New York Times inaccurately says, she earned a combined masters degree in Politics, Philosophy, and Economics.  More accurately, it was a combined bachelors degree.  Then she went to the Massachusetts Institute of Technology where she undertook concentrations on nuclear weapons, China, and the Soviet Union....",baseline_with_expansion,non-relevant,non-relevant,non-relevant,non-relevant
h.-r.-mcmaster-position-held-national-security-advisor.txt,...  White House Office:    Office of the National Security Advisor:   McMaster  Assistant to the President and Deputy National Security Advisor: K.  T.  McFarland  Assistant to the President for Homeland Security And Counterterrorism  and Deputy National Security Advisor: Thomas Bossert   Assistant to the President and Deputy National Security Advisor for Strategy: Dina Powell  McMaster  Assistant to the President and Deputy National Security Advisor: K....,proposed,relevant,relevant,relevant,relevant
adele-award-received-brit-award-for-british-female-solo-artist.txt,"...  Adele:    2015–present: 25 and Adele Live 2016:   Her North American Tour began in July, with the opening concert in St.  Paul, Minnesota on 5 July.  At the 2016 Brit Awards in London on 24 February, Adele received the awards for British Female Solo Artist, British Album of the Year for 25, British Single of the Year for ""Hello"", and British Global Success, bringing her Brit Award wins to eight.  She closed the ceremony by performing ""When We Were Young  "", the second single from 25....",proposed,relevant,relevant,relevant,relevant
adele-award-received-brit-award-for-british-female-solo-artist.txt,"...  Adele:   Intro | signature = Adele Signature. svg}}Adele Laurie Blue Adkins  is an English singer-songwriter.  After graduating from the BRIT School for Performing Arts and Technology in 2006, Adele was given a recording contract by XL Recordings after a friend posted her demo on Myspace the same year.  In 2007, she received the Brit Awards ""Critics Choice"" award and won the BBC Sound of 2008 poll.  Her debut album, 19  , was released in 2008 to commercial and critical success....",baseline,relevant,relevant,relevant,relevant
adele-award-received-brit-award-for-british-female-solo-artist.txt,"...She is the recipient of nine Brit Awards, an Academy Award, a Golden Globe Award, fifteen Grammy Awards, eighteen Billboard Music Awards  , five American Music Awards, and two Ivor Novello Awards for Songwriter of the Year. Adele signed a contract with the record label XL Recordings in September 2006.  She won the BBC Sound of 2008  , an annual poll awarded to recognise newcomers in the music industry.  Later in the same year, she released her debut album 19  , and won the Brit Awards for Critics Choice.  Several singles were released from the album, including the Grammy Award for Best Female Pop Vocal Performance-winning song ""Chasing Pavements"", which also garnered an MTV Video Music Award for Best Choreography nomination....",baseline,relevant,relevant,partial,relevant
adele-award-received-brit-award-for-british-female-solo-artist.txt,"...""Someone like You"" and ""Set Fire to the Rain"" won Best Pop Solo Performance  at the 54th  and 55th Annual Grammy Awards, respectively.  Adele was awarded several other accolades, including the Echo Music Award and Grammy Award  for Album of the Year, and won in 12 Billboard Music Award  categories....",baseline,partial,non-relevant,non-relevant,non-relevant
adele-award-received-brit-award-for-british-female-solo-artist.txt,...  List of awards and nominations received by Kate Bush:   Intro This is a list of music awards and award nominations received by the English singer/songwriter Kate Bush....,baseline,relevant,non-relevant,non-relevant,non-relevant
adele-award-received-brit-award-for-british-female-solo-artist.txt,"...  List of awards and nominations received by Adele:    Brit Awards:   Adele has received nine awards from fourteen nominations.  ! |-!scope=""row""| 2008  | rowspan=""3""|Adele| Critics Choice| | style=""text-align:center;""| |-!scope=""row"" rowspan=""3""|2009  | British Female Solo Artist| | rowspan=""3"" style=""text-align:center;""| |-| British Breakthrough Act  | |-|""Chasing Pavements""| British Single of the Year| |-!scope=""row"" rowspan=""3""|2012  | Adele| British Female Solo Artist| | rowspan=""3"" style=""text-align:center;""| |-| ""Someone like You""| British Single of the Year| |-| 21| British Album of the Year| |-!scope=""row""| 2013  | ""Skyfall""| British Single of the Year| | style=""text-align:center;""| |-!scope=""row"" rowspan=""5""|2016  |rowspan=""2""| Adele| British Female Solo Artist| | rowspan=""5"" style=""text-align:center;"" | |-| Global Success Award| |-| 25| British Album of the Year| |-|rowspan=""2""| ""Hello  ""| British Single of the Year|rowspan |-| British Artist Video Of The Year| |-!scope=""row""| 2017  | Adele| Global Success Award| | align=""center""| |}  Adele has received nine awards from fourteen nominations. ...",proposed,relevant,relevant,relevant,relevant
adele-award-received-brit-award-for-british-female-solo-artist.txt,"...Her career has led to three Goldene Europa awards, an Echo Award, a Variety Club of Great Britain Award, a Gold Badge award for her contribution to Britains Music Industry, and a Steiger Award for a lifetime career in music.  She has also been nominated for three Grammy Awards, three Brit Awards, two American Music Awards, two Echo Awards and much more. Tyler represented the United Kingdom at the World Popular Song Festival in 1979, winning the festival with her song ""Sitting on the Edge of the Ocean"".  She later represented the United Kingdom at the Eurovision Song Contest  in 2013, and became the first recipient at the Eurovision Song Contest Radio Awards for her country. Academy of Country Music Awards Academy of Country Music Awards is an annual country music awards show, established in 1964....",baseline_with_expansion,partial,relevant,non-relevant,non-relevant
adele-award-received-brit-award-for-british-female-solo-artist.txt,"...  List of awards and nominations received by Adele:    Brit Awards:  The Brit Awards are the British Phonographic Industrys  annual pop music awards.  Adele has received nine awards from fourteen nominations.  ! |-!scope=""row""| 2008  | rowspan=""3""|Adele| Critics Choice| | style=""text-align:center;""| |-!scope=""row"" rowspan=""3""|2009  | British Female Solo Artist| | rowspan=""3"" style=""text-align:center;""| |-| British Breakthrough Act  | |-|""Chasing Pavements""| British Single of the Year| |-!scope=""row"" rowspan=""3""|2012  | Adele| British Female Solo Artist| | rowspan=""3"" style=""text-align:center;""| |-| ""Someone like You""| British Single of the Year| |-| 21| British Album of the Year| |-!scope=""row""| 2013  | ""Skyfall""| British Single of the Year| | style=""text-align:center;""| |-!scope=""row"" rowspan=""5""|2016  |rowspan=""2""| Adele| British Female Solo Artist| | rowspan=""5"" style=""text-align:center;"" | |-| Global Success Award| |-| 25| British Album of the Year| |-|rowspan=""2""| ""Hello  ""| British Single of the Year|rowspan |-| British Artist Video Of The Year| |-!scope=""row""| 2017  | Adele| Global Success Award| | align=""center""| |}...",proposed,relevant,relevant,partial,relevant
adele-award-received-brit-award-for-british-female-solo-artist.txt,"...""Someone like You"" and ""Set Fire to the Rain"" won Best Pop Solo Performance  at the 54th  and 55th Annual Grammy Awards, respectively.  Adele was awarded several other accolades, including the Echo Music Award and Grammy Award  for Album of the Year, and won in 12 Billboard Music Award  categories....",baseline_with_expansion,non-relevant,non-relevant,non-relevant,non-relevant
adele-award-received-brit-award-for-british-female-solo-artist.txt,"...  Adele:    Awards and achievements:   ""Skyfall"" won the Brit Award for Best British Single at the 2013 Brit Awards.  Released in 2015, Adeles third album, 25, became the years best-selling album and broke first week sales records  in a number of markets, including the UK and the US.  25 was her second album to be certified diamond in the US and earned her five Grammy Awards  , including her second Grammy Award for Album of the Year, and four Brit Awards  for British Female Solo Artist, British Album of the Year, British Single of the Year for ""Hello  "", and British Global Success.  Adeles seven weeks at the top of the UK Albums Chart took her total to 31 weeks at number one in the UK with her three albums, surpassing Madonna  s previous record of most weeks at number one for a female act in the UK.  The lead single, ""Hello"", became the first song in the US to sell over one million digital copies within a week of its release....",proposed,relevant,relevant,partial,relevant
adele-award-received-brit-award-for-british-female-solo-artist.txt,"...Her 2007 song ""Hometown Glory"" was nominated for a Grammy Award in the Best Female Pop Vocal Performance category.  At the 51st Annual Grammy Awards, she earned the Best New Artist  award, with two additional nominations at the same ceremony. Adeles second studio album 21  was released in January 2011 and held the top position for 24 weeks in the United States....",baseline_with_expansion,partial,non-relevant,non-relevant,non-relevant
adele-award-received-brit-award-for-british-female-solo-artist.txt,"...Three of its singles ""Rolling in the Deep"", ""Someone like You  "", and ""Set Fire to the Rain"" reached number one on the Billboard Hot 100  .  The former won three Grammy Awards – Song of the Year  , Record of the Year  , and Best Short Form Music Video  .  ""Someone like You"" and ""Set Fire to the Rain"" won Best Pop Solo Performance  at the 54th  and 55th Annual Grammy Awards, respectively....",baseline_with_expansion,non-relevant,non-relevant,non-relevant,non-relevant
adele-award-received-brit-award-for-british-female-solo-artist.txt,"...Three of its singles ""Rolling in the Deep"", ""Someone like You  "", and ""Set Fire to the Rain"" reached number one on the Billboard Hot 100  .  The former won three Grammy Awards – Song of the Year  , Record of the Year  , and Best Short Form Music Video  .  ""Someone like You"" and ""Set Fire to the Rain"" won Best Pop Solo Performance  at the 54th  and 55th Annual Grammy Awards, respectively....",baseline,non-relevant,non-relevant,non-relevant,non-relevant
adele-award-received-brit-award-for-british-female-solo-artist.txt,"...The album has sold over 31 million copies worldwide.  The success of 21 earned Adele numerous mentions in the Guinness Book of World Records  .  She is the first woman in the history of the Billboard Hot 100  to have three simultaneous top 10 singles as a lead artist, and the first female artist to simultaneously have two albums in the top five of the Billboard 200  and two singles in the top five of the Billboard Hot 100.  21 is the longest-running number one album by a female solo artist in the history of the UK and US Album Charts....",baseline_with_expansion,partial,partial,non-relevant,partial
adele-award-received-brit-award-for-british-female-solo-artist.txt,"...  Adele:    2011–2014: 21, worldwide recognition and hiatus:   Following that success, 21 achieved the biggest weekly sales increase following a Grammy win since Nielsen SoundScan began tracking data in 1991.  Adele received the Brit Award for Best British Female  Solo Artist, and British Album of the Year  presented to her by George Michael.  Following the Brit Awards, 21 reached number one for the 21st non-consecutive week in the UK.  The album has sold over 4....",proposed,relevant,relevant,relevant,relevant
bruno-mars-award-received-grammy-award.txt,"...  List of awards and nominations received by Bruno Mars:    Daytime Emmy Awards:  The Daytime Emmy Award is an American accolade bestowed by the New York  –based National Academy of Television Arts and Sciences in recognition of excellence in American  daytime television programming.  Emmys are considered the television equivalent to the Academy Awards , Grammy Awards  and Tony Awards .   | Mark Ronson and Bruno Mars in The Ellen DeGeneres Show| Outstanding Musical Performance in a Talk Show/Morning Program ...",proposed,relevant,relevant,relevant,relevant
bruno-mars-award-received-grammy-award.txt,"...svg }} Politics and government Tallest buildings Albuquerque  · Atlanta  · Baltimore  · Bellevue  · Boston  · Brooklyn  · Bucharest  · Chicago  · Cleveland  · Columbus, Ohio  · Dayton, Ohio  · Denver  · Detroit  · Dubai  · Houston  · Hong Kong  · Indianapolis  · Jersey City  · Las Vegas  · London  · Los Angeles  · Manchester  · Miami  · Minneapolis  · Mobile, Alabama  · New Orleans  · New York City  · Oakland, California  · Oklahoma City  · Philadelphia  · Pittsburgh  · Portland, Oregon  · Providence, Rhode Island  · Salford  · San Diego  · San Francisco  · Seattle  · Shanghai  · Singapore  · Tampa  · · Tulsa, Oklahoma  · Washington, D....",baseline,non-relevant,non-relevant,non-relevant,non-relevant
bruno-mars-award-received-grammy-award.txt,"...He is the recipient of a BT Digital Music Award  , three Brit Awards, an Echo Award, a JUNO Award, five Grammy Awards, three Soul Train Music Awards, and an American Music Award.  He has also been nominated for two ARIA Music Awards, eight BET Awards, two MOBO Awards, and eleven NAACP Image Awards. Mars initially came to prominence as an acknowledged music producer and lyricist, who composed songs for other artists along with his production team The Smeezingtons.  They were responsible for composing Mars first collaboration with B. o....",baseline,non-relevant,relevant,non-relevant,non-relevant
bruno-mars-award-received-grammy-award.txt,"...  List of awards and nominations received by Bruno Mars:   Intro }}American singer and songwriter Bruno Mars has received 72 awards from 243 nominations.  He is the recipient of a BT Digital Music Award  , three Brit Awards, an Echo Award, a JUNO Award, five Grammy Awards, three Soul Train Music Awards, and an American Music Award.  He has also been nominated for two ARIA Music Awards, eight BET Awards, two MOBO Awards, and eleven NAACP Image Awards....",baseline,partial,relevant,relevant,relevant
bruno-mars-award-received-grammy-award.txt,"...He won the awards for Best Male Artist at several award ceremonies in 2011 and 2012, including American Music Award for Favorite Pop/Rock Male Artist, International Male Solo Artist at the Brit Awards and the Echo Award for Best International Male. Mars second studio album Unorthodox Jukebox was released in December 2012.  Two of its singles ""Locked Out of Heaven"", and ""When I Was Your Man"" reached number one at the Billboard Hot 100.  The album was nominated for four Grammy Awards at the 56th Annual Grammy Awards, including Best Pop Vocal Album  and Record of the Year for ""Locked Out of Heaven"", it won the former award....",baseline,relevant,relevant,non-relevant,relevant
bruno-mars-award-received-grammy-award.txt,"...  List of awards and nominations received by Bruno Mars:    Intro:  B, the single ""Nothin on You"", which won Song of the Year at the 2010 Soul Train Music Awards and at the 52nd Annual Grammy Awards it was nominated in three categories, including Record of the Year  .  Mars debut studio album, Doo-Wops Hooligans, released in 2010 produced two Billboard Hot 100  number one singles ""Just the Way You Are  "" and ""Grenade  "".  The former won a Best Male Pop Vocal Performance at the 53rd Annual Grammy Awards, while the latter received three nominations including Song of the Year  at the following ceremony  ....",proposed,relevant,relevant,relevant,relevant
